{
  "command_id": "cmd-01",
  "expected_revision": 7,
  "op": "accept_result",
  "payload_ref": {
    "bytes": 769,
    "media_type": "application/json",
    "sha256": "5e0034d35cf3e900510396c8139045c9b26cbd69637c060bc1899a200f2c9ea2"
  },
  "policy_digest": "aaaaaaaaaaaaaaaaaaaaaaaaaaaaaaaaaaaaaaaaaaaaaaaaaaaaaaaaaaaaaaaa",
  "run_id": "run-01",
  "schema": "gabriel.command/1",
  "task_id": "task-01",
  "workspace_id": "ws-01"
}
